{
  "blocks": [
    {
      "duration_min": 10,
      "machine": "",
      "type": "cardio"
    },
    {
      "exercise": "поштовх гирі",
      "notes": "5 × 3, вибух (або застрибування на тумбу)",
      "sets": [],
      "type": "strength"
    },
    {
      "exercises": [
        {
          "name": "інтервальна робота"
        }
      ],
      "format": "intervals",
      "notes": "8 × 30с робота / 90с відпочинок, ~15 хв; алактатний домен — найкоротший, зазвичай недобраний (P9)",
      "type": "metcon"
    },
    {
      "exercise": "підйом на середню дельту",
      "sets": [
        {
          "reps": 6
        },
        {
          "reps": 6
        },
        {
          "reps": 6
        },
        {
          "reps": 6
        }
      ],
      "type": "strength"
    },
    {
      "exercise": "вис",
      "notes": "4 × макс, секунди; хват",
      "sets": [],
      "type": "strength"
    },
    {
      "type": "cooldown"
    }
  ],
  "cycle_day": "D1",
  "date": "2026-08-04",
  "kind": "training",
  "notes": "Меткон-день: тримати сесію ≤1.5 год (P-час) — розминка 10 хв, гіперекстензія відсутня."
}
