{
  "blocks": [
    {
      "duration_min": 10,
      "machine": "",
      "type": "cardio"
    },
    {
      "exercise": "протяжка ривкова",
      "notes": "5 × 2, вибух; історичні дані: 90 кг (2+2)",
      "sets": [],
      "type": "strength"
    },
    {
      "exercises": [
        {
          "name": "гирі"
        },
        {
          "name": "скакалка"
        },
        {
          "name": "альпініст"
        }
      ],
      "format": "amrap",
      "notes": "AMRAP 15 хв; аеробний домен",
      "type": "metcon"
    },
    {
      "exercise": "підйоми на носки",
      "sets": [
        {
          "reps": 6
        },
        {
          "reps": 6
        },
        {
          "reps": 6
        },
        {
          "reps": 6
        },
        {
          "reps": 6
        }
      ],
      "type": "strength"
    },
    {
      "exercise": "прокручування кисті з гантелею",
      "notes": "хват",
      "sets": [
        {
          "reps": 8
        },
        {
          "reps": 8
        },
        {
          "reps": 8
        },
        {
          "reps": 8
        }
      ],
      "type": "strength"
    },
    {
      "type": "cooldown"
    }
  ],
  "cycle_day": "C1",
  "date": "2026-07-30",
  "kind": "training",
  "notes": "Меткон-день: тримати сесію ≤1.5 год (P-час) — розминка 10 хв, гіперекстензія відсутня."
}
