{
  "blocks": [
    {
      "duration_min": 10,
      "machine": "",
      "type": "cardio"
    },
    {
      "exercise": "ривок",
      "notes": "4 × 3, вибух; повний відпочинок, стоп по падінню швидкості штанги (P3)",
      "sets": [],
      "type": "strength"
    },
    {
      "exercises": [
        {
          "name": "трастери"
        },
        {
          "name": "бьорпі"
        },
        {
          "name": "перекидання м'яча"
        }
      ],
      "format": "for_time",
      "notes": "21-15-9 на час; гліколітичний домен ~10-20 хв; фіксувати спліти + ЧСС по раундах",
      "scheme": [
        21,
        15,
        9
      ],
      "type": "metcon"
    },
    {
      "exercise": "підйом на середню дельту",
      "sets": [
        {
          "reps": 6
        },
        {
          "reps": 6
        },
        {
          "reps": 6
        },
        {
          "reps": 6
        },
        {
          "reps": 6
        }
      ],
      "type": "strength"
    },
    {
      "exercise": "вис",
      "notes": "4 × макс, секунди; хват",
      "sets": [],
      "type": "strength"
    },
    {
      "type": "cooldown"
    }
  ],
  "cycle_day": "A1",
  "date": "2026-07-21",
  "kind": "training",
  "notes": "Меткон-день: тримати сесію ≤1.5 год (P-час) — розминка 10 хв, гіперекстензія відсутня."
}
