{
  "blocks": [
    {
      "duration_min": 15,
      "machine": "",
      "type": "cardio"
    },
    {
      "exercise": "гіперекстензія",
      "sets": [
        {
          "reps": 12
        },
        {
          "reps": 12
        }
      ],
      "type": "strength"
    },
    {
      "exercise": "жим стоячи",
      "notes": "рамп + бек-оф (вісімки); єдиний об'ємний слот циклу (P5); рішення стоячи/нахил ще не ухвалене",
      "sets": [],
      "type": "strength"
    },
    {
      "exercise": "жим на нахилі",
      "notes": "якщо головна — жим стоячи",
      "sets": [
        {
          "reps": 6
        },
        {
          "reps": 6
        },
        {
          "reps": 6
        },
        {
          "reps": 6
        }
      ],
      "type": "strength"
    },
    {
      "exercise": "підтягування",
      "notes": "вертикальна тяга",
      "sets": [
        {
          "reps": 6
        },
        {
          "reps": 6
        },
        {
          "reps": 6
        },
        {
          "reps": 6
        }
      ],
      "type": "strength"
    },
    {
      "exercise": "кисть з гантелею",
      "notes": "хват",
      "sets": [
        {
          "reps": 6
        },
        {
          "reps": 6
        },
        {
          "reps": 6
        },
        {
          "reps": 6
        }
      ],
      "type": "strength"
    },
    {
      "type": "cooldown"
    }
  ],
  "cycle_day": "D2",
  "date": "2026-08-06",
  "kind": "training"
}
