{
  "blocks": [
    {
      "distance_m": 1673,
      "duration_min": 10,
      "end_time": "7:53",
      "machine": "гребля",
      "type": "cardio"
    },
    {
      "end_time": "8:02",
      "exercise": "гіперекстензія",
      "sets": [
        {
          "reps": 12,
          "weight_kg": 15
        },
        {
          "reps": 12,
          "weight_kg": 28
        }
      ],
      "type": "strength"
    },
    {
      "end_time": "8:28",
      "exercise": "присід фронтальний",
      "notes": "Ramp to top set. Final set dropped to 3 reps — reps written above the weight on paper.",
      "sets": [
        {
          "rep_band": "base",
          "reps": 6,
          "weight_kg": 70
        },
        {
          "rep_band": "base",
          "reps": 6,
          "weight_kg": 80
        },
        {
          "rep_band": "base",
          "reps": 6,
          "weight_kg": 90
        },
        {
          "rep_band": "base",
          "reps": 6,
          "weight_kg": 100
        },
        {
          "rep_band": "heavy",
          "reps": 3,
          "weight_kg": 110
        }
      ],
      "start_time": "8:05",
      "type": "strength"
    },
    {
      "end_time": "8:36",
      "exercise": "згинання ніг стоячи",
      "sets": [
        {
          "reps": 6,
          "weight_kg": 25
        },
        {
          "reps": 6,
          "weight_kg": 30
        },
        {
          "reps": 6,
          "weight_kg": 35
        },
        {
          "reps": 6,
          "weight_kg": 40
        },
        {
          "reps": 6,
          "weight_kg": 45
        }
      ],
      "type": "strength"
    },
    {
      "end_time": "8:46",
      "exercise": "підйоми на носки",
      "sets": [
        {
          "reps": 6,
          "weight_kg": 40
        },
        {
          "reps": 6,
          "weight_kg": 50
        },
        {
          "reps": 6,
          "weight_kg": 55
        },
        {
          "reps": 6,
          "weight_kg": 60
        },
        {
          "reps": 6,
          "weight_kg": 65
        }
      ],
      "type": "strength"
    },
    {
      "end_time": "8:55",
      "exercise": "підйоми на середню дельту",
      "sets": [
        {
          "reps": 6,
          "weight_kg": 8
        },
        {
          "reps": 6,
          "weight_kg": 10
        },
        {
          "reps": 6,
          "weight_kg": 12
        },
        {
          "reps": 6,
          "weight_kg": 14
        },
        {
          "reps": 6,
          "weight_kg": 16
        }
      ],
      "type": "strength"
    },
    {
      "end_time": "9:09",
      "exercise": "вис",
      "notes": "Superset with wrist rotations (bracketed together on paper).",
      "sets": [
        {
          "duration_sec": 40
        },
        {
          "duration_sec": 38
        },
        {
          "duration_sec": 36
        },
        {
          "duration_sec": 30
        }
      ],
      "type": "strength"
    },
    {
      "end_time": "9:09",
      "exercise": "прокручування кисті з гантелею",
      "sets": [
        {
          "reps": 8,
          "weight_kg": 8
        },
        {
          "reps": 8,
          "weight_kg": 10
        },
        {
          "reps": 8,
          "weight_kg": 12
        },
        {
          "reps": 8,
          "weight_kg": 14
        }
      ],
      "type": "strength"
    },
    {
      "end_time": "9:19",
      "type": "cooldown"
    }
  ],
  "cycle_day": "C2",
  "date": "2026-06-23",
  "kind": "training",
  "notes": "Heavy day. Front squat ramp to 110. Transcribed from paper journal; some weights uncertain.",
  "start_time": "7:45"
}
